{
  "$schema": "https://json-schema.org/draft/2020-12/schema",
  "$id": "https://atniclimate.org/ddm/schemas/enso-index-candidate.json",
  "title": "DDM ENSO index candidate",
  "description": "One proposed observed index for the ENSO briefing in src/impact/enso.ts. Encodes the five wiring gates from planning/user-research/2026-09-07-enso-expansion-proposal.md section 4. A candidate advances past its decision record only when every gate is true and every receipt is filled.",
  "type": "object",
  "additionalProperties": false,
  "required": [
    "slug",
    "name",
    "status",
    "issuer",
    "machine_file",
    "issuer_meaning",
    "claim",
    "decision_record",
    "user_need",
    "snapshot_block",
    "register_slug",
    "acceptance_spec",
    "verifier",
    "gates",
    "notes"
  ],
  "properties": {
    "slug": {
      "type": "string",
      "pattern": "^[a-z][a-z0-9-]*$",
      "description": "Kebab-case identifier for this candidate file. Also the default register slug."
    },
    "name": {
      "type": "string",
      "description": "Plain-language name as a reader would see it, e.g. 'equatorial upper-ocean heat content anomaly'."
    },
    "status": {
      "type": "string",
      "enum": ["candidate", "decided", "wired", "declined"],
      "description": "candidate: filled in, no DR yet. decided: DR ruled. wired: block, claim and spec landed. declined: DR ruled against; keep the file."
    },
    "issuer": {
      "type": "object",
      "additionalProperties": false,
      "required": ["name", "product_url"],
      "properties": {
        "name": { "type": "string", "description": "The issuing agency exactly as it names itself, spelled out on first use." },
        "product_url": { "type": ["string", "null"], "format": "uri", "description": "The product page a reader is sent to, where the issuer states the base period and rules. Never the bare data file." }
      }
    },
    "machine_file": {
      "type": "object",
      "additionalProperties": false,
      "required": ["url", "format", "cadence", "base_period", "units", "carries_published_date", "fetched_by", "last_checked", "http_status", "last_modified"],
      "properties": {
        "url": { "type": ["string", "null"], "format": "uri", "description": "The machine-readable file the builder fetches. Null until verified live." },
        "format": { "type": ["string", "null"], "enum": ["fixed-width-text", "csv", "json", "netcdf", "ascii-table", null] },
        "cadence": { "type": ["string", "null"], "enum": ["weekly", "monthly", "seasonal", "pentad", "daily", null] },
        "base_period": { "type": ["string", "null"], "description": "As the issuer states it, e.g. '1991-2020'. An anomaly with no stated base period cannot be shown (DR-033 rule)." },
        "units": { "type": ["string", "null"], "description": "As the issuer states them." },
        "carries_published_date": { "type": ["boolean", "null"], "description": "True if the file or its page states when it was published, so the claim's dates.published can be filled." },
        "fetched_by": { "type": "string", "const": "scripts/build-enso-snapshot.mjs", "description": "Always the builder. The browser never fetches an upstream file." },
        "last_checked": { "type": ["string", "null"], "pattern": "^\\d{4}-\\d{2}-\\d{2}$" },
        "http_status": { "type": ["integer", "null"] },
        "last_modified": { "type": ["string", "null"], "description": "The Last-Modified header verbatim. A frozen file (see DR-031 on wksst8110.for) fails this gate." }
      }
    },
    "issuer_meaning": {
      "type": "object",
      "additionalProperties": false,
      "required": ["quote", "url", "quote_word_count"],
      "properties": {
        "quote": { "type": ["string", "null"], "description": "The issuer's own sentence saying what the index is. Under 15 words. This is what the claim may quote; the claim may not interpret." },
        "url": { "type": ["string", "null"], "format": "uri" },
        "quote_word_count": { "type": ["integer", "null"], "maximum": 14 }
      }
    },
    "claim": {
      "type": "object",
      "additionalProperties": false,
      "required": ["horizon", "kind", "evidence", "proposed_text", "contains_forecast_language", "withheld_when_stale"],
      "properties": {
        "horizon": { "type": "string", "enum": ["current", "nearTerm", "longRange"], "description": "current unless the issuer frames the product itself as an outlook." },
        "kind": { "type": "string", "enum": ["observation", "issuer-outlook"], "description": "observation: what the index shows now. issuer-outlook: only when the issuer publishes it as an outlook and the claim quotes that framing." },
        "evidence": { "type": "string", "enum": ["analyzed", "derived", "outlook"], "description": "The makeClaim evidence value. analyzed for an issuer index read; derived for a DDM computation on issuer numbers; outlook only for kind issuer-outlook." },
        "proposed_text": { "type": ["string", "null"], "description": "The full sentence as it would render. Must pass tests/enso-forecast-language.ts." },
        "contains_forecast_language": { "type": ["boolean", "null"], "description": "Result of running proposed_text against the forbidden list. Must be false to advance." },
        "withheld_when_stale": { "type": "boolean", "const": true }
      }
    },
    "decision_record": {
      "type": ["string", "null"],
      "pattern": "^DR-\\d{3}$",
      "description": "The DR id once opened. Null while status is candidate. No id is minted in this file."
    },
    "user_need": {
      "type": "object",
      "additionalProperties": false,
      "required": ["ledger_path", "who", "quote"],
      "properties": {
        "ledger_path": { "type": ["string", "null"], "description": "Path under planning/user-research/ where the need is recorded." },
        "who": { "type": ["string", "null"], "description": "Role, not name, e.g. 'Tribal water program staff'." },
        "quote": { "type": ["string", "null"], "description": "What they asked for, in their words." }
      }
    },
    "snapshot_block": {
      "type": "object",
      "additionalProperties": false,
      "required": ["key", "type_stem", "optional", "guard", "drop_when_malformed", "required_blocks_unchanged"],
      "properties": {
        "key": { "type": "string", "pattern": "^[a-z][A-Za-z0-9]*$", "description": "camelCase key on EnsoSnapshot, e.g. nino34Weekly." },
        "type_stem": { "type": "string", "pattern": "^[A-Z][A-Za-z0-9]*$", "description": "PascalCase stem for the Point and Series types." },
        "optional": { "type": "boolean", "const": true },
        "guard": { "type": "string", "pattern": "^is[A-Z][A-Za-z0-9]*Series$" },
        "drop_when_malformed": { "type": "boolean", "const": true },
        "required_blocks_unchanged": { "type": "boolean", "const": true, "description": "RONI and ONI remain the only required blocks." }
      }
    },
    "register_slug": { "type": "string", "pattern": "^[a-z][a-z0-9-]*$" },
    "acceptance_spec": {
      "type": "object",
      "additionalProperties": false,
      "required": ["path", "fixtures", "in_verify_smoke"],
      "properties": {
        "path": { "type": ["string", "null"], "pattern": "^tests/enso-[a-z0-9-]+\\.spec\\.ts$" },
        "fixtures": {
          "type": "array",
          "minItems": 3,
          "items": { "type": "string", "enum": ["with-block", "without-block", "stale"] },
          "description": "All three are required."
        },
        "in_verify_smoke": { "type": ["boolean", "null"] }
      }
    },
    "verifier": {
      "type": "object",
      "additionalProperties": false,
      "required": ["agent", "date", "verdict", "flags"],
      "properties": {
        "agent": { "type": "string", "const": "ddm-science-verifier" },
        "date": { "type": ["string", "null"], "pattern": "^\\d{4}-\\d{2}-\\d{2}$" },
        "verdict": { "type": ["string", "null"], "enum": ["verified", "flagged", "rejected", null] },
        "flags": { "type": "array", "items": { "type": "string" } }
      }
    },
    "gates": {
      "type": "object",
      "additionalProperties": false,
      "required": ["machine_file", "issuer_meaning", "observation_only", "decision_record", "user_need"],
      "description": "The five wiring gates. All five true before any code lands. Each is a summary of the receipts above, not a substitute for them.",
      "properties": {
        "machine_file": { "type": "boolean" },
        "issuer_meaning": { "type": "boolean" },
        "observation_only": { "type": "boolean" },
        "decision_record": { "type": "boolean" },
        "user_need": { "type": "boolean" }
      }
    },
    "notes": { "type": "array", "items": { "type": "string" } }
  }
}
