{
  "slug": "cpc-equatorial-upper-ocean-heat-content",
  "name": "equatorial Pacific upper-ocean heat content anomaly, 0-300 m",
  "status": "candidate",
  "issuer": {
    "name": "National Oceanic and Atmospheric Administration (NOAA) Climate Prediction Center (CPC)",
    "product_url": null
  },
  "machine_file": {
    "url": null,
    "format": null,
    "cadence": null,
    "base_period": null,
    "units": null,
    "carries_published_date": null,
    "fetched_by": "scripts/build-enso-snapshot.mjs",
    "last_checked": null,
    "http_status": null,
    "last_modified": null
  },
  "issuer_meaning": {
    "quote": null,
    "url": null,
    "quote_word_count": null
  },
  "claim": {
    "horizon": "current",
    "kind": "observation",
    "evidence": "analyzed",
    "proposed_text": null,
    "contains_forecast_language": null,
    "withheld_when_stale": true
  },
  "decision_record": null,
  "user_need": {
    "ledger_path": null,
    "who": null,
    "quote": null
  },
  "snapshot_block": {
    "key": "upperOceanHeat",
    "type_stem": "UpperOceanHeat",
    "optional": true,
    "guard": "isUpperOceanHeatSeries",
    "drop_when_malformed": true,
    "required_blocks_unchanged": true
  },
  "register_slug": "cpc-equatorial-upper-ocean-heat-content",
  "acceptance_spec": {
    "path": "tests/enso-upper-ocean-heat.spec.ts",
    "fixtures": ["with-block", "without-block", "stale"],
    "in_verify_smoke": null
  },
  "verifier": {
    "agent": "ddm-science-verifier",
    "date": null,
    "verdict": null,
    "flags": []
  },
  "gates": {
    "machine_file": false,
    "issuer_meaning": false,
    "observation_only": false,
    "decision_record": false,
    "user_need": false
  },
  "notes": [
    "Received in the 2026-09-07 expansion proposal as a 'subsurface precursor' for nearTerm. Ruled: current horizon, observation only, or not at all.",
    "Lead to verify, not a fact: CPC's ENSO monitoring products include an equatorial upper-ocean heat content anomaly series; PSL also serves related series. Find the file from the CPC ENSO monitoring index page and record the receipt; do not construct a URL.",
    "The index is widely described as leading SST. That is why the proposed_text must not say so. If the only issuer sentence available frames it as an outlook, claim.kind becomes issuer-outlook and the DR default is option (b): carry the data, show nothing.",
    "Every gate is false until a session fills the receipt above it. The file is complete as a template when all five are true and status is decided."
  ]
}
